{
  "sample_id": "GT-FLY-002",
  "participant_id": "PARTICIPANT-008",
  "session_id": "SESSION-008",
  "stroke_type": "Butterfly",
  "video_id": "VIDEO-GT-FLY-002",
  "video_filename": "GT-FLY-002.mp4",
  "video_sha256": "18174f3508f45ca0395ee0a138fd752406a72c4ac95b9d611499f4719a0da49f",
  "source_type": "HIGH_SPEED_OPTICAL_DUAL_RATER",
  "annotation_version": "1.0.0",
  "annotator_id": "EXPERT-RATER-02",
  "secondary_annotator_id": null,
  "annotation_timestamp": "2026-09-06T13:45:00Z",
  "video_fps": 30.0,
  "video_duration": 13.9,
  "frame_count": 417,
  "pool_context": {
    "pool_length_m": 25.0,
    "water_type": "Chlorinated",
    "camera_position": "Poolside_Surface",
    "calibration_type": "Body_Normalized"
  },
  "demographics": {
    "sex": "Male",
    "age_group": "Junior",
    "competition_level": "Club"
  },
  "cycle_annotations": [
    {
      "cycle_index": 1,
      "start_frame": 50,
      "end_frame": 97,
      "duration_ms": 1566.7,
      "stroke_rate_spm": 38.3,
      "phase_events": [
        {
          "phase_name": "entry",
          "transition_frame": 50
        },
        {
          "phase_name": "pull",
          "transition_frame": 67
        },
        {
          "phase_name": "recovery",
          "transition_frame": 84
        }
      ]
    },
    {
      "cycle_index": 2,
      "start_frame": 95,
      "end_frame": 143,
      "duration_ms": 1600.0,
      "stroke_rate_spm": 37.5,
      "phase_events": [
        {
          "phase_name": "entry",
          "transition_frame": 97
        },
        {
          "phase_name": "pull",
          "transition_frame": 114
        },
        {
          "phase_name": "recovery",
          "transition_frame": 131
        }
      ]
    },
    {
      "cycle_index": 3,
      "start_frame": 143,
      "end_frame": 189,
      "duration_ms": 1533.3,
      "stroke_rate_spm": 39.13,
      "phase_events": [
        {
          "phase_name": "entry",
          "transition_frame": 143
        },
        {
          "phase_name": "pull",
          "transition_frame": 160
        },
        {
          "phase_name": "recovery",
          "transition_frame": 177
        }
      ]
    }
  ],
  "metric_annotations": {
    "stroke_rate_spm": {
      "value": 38.3,
      "source_modality": "HUMAN_VIDEO_ANNOTATION",
      "temporal_reference": "MID_POOL_STEADY_STATE"
    },
    "cycle_duration_ms": {
      "value": 1566.4,
      "source_modality": "HUMAN_VIDEO_ANNOTATION"
    },
    "true_dps_meters": {
      "value": null,
      "source_modality": "CALIBRATED_OPTICAL"
    },
    "hand_excursion_proxy_bl": {
      "value": 0.89,
      "source_modality": "HUMAN_VIDEO_ANNOTATION"
    },
    "mean_elbow_angle_deg": {
      "value": 127.2,
      "source_modality": "HUMAN_VIDEO_ANNOTATION",
      "angle_dimension": "2D_PLANAR"
    },
    "mean_knee_angle_deg": {
      "value": 143.0,
      "source_modality": "HUMAN_VIDEO_ANNOTATION",
      "angle_dimension": "2D_PLANAR"
    },
    "body_roll_amplitude_deg": {
      "value": 10.7,
      "source_modality": "HUMAN_VIDEO_ANNOTATION",
      "angle_dimension": "2D_PLANAR"
    },
    "stroke_symmetry_percent": {
      "value": 96.4,
      "source_modality": "HUMAN_VIDEO_ANNOTATION",
      "operational_definition": "Bilateral arm cycle phase duration symmetry (left/right ratio * 100)"
    }
  },
  "quality_flags": {
    "occlusion_level": "LOW",
    "lighting_quality": "HIGH",
    "water_turbulence": "CALM",
    "inter_rater_agreement_icc": null,
    "requires_adjudication": false
  },
  "exclusion_status": "INCLUDED",
  "exclusion_reason": null,
  "is_synthetic_fixture": false
}