{
  "sample_id": "GT-BACK-002",
  "participant_id": "PARTICIPANT-004",
  "session_id": "SESSION-004",
  "stroke_type": "Backstroke",
  "video_id": "VIDEO-GT-BACK-002",
  "video_filename": "GT-BACK-002.mp4",
  "video_sha256": "9d06708aa0f9167ca730201d563030cd9292e04aacef5dfaa8c33d21fe7fc74e",
  "source_type": "HIGH_SPEED_OPTICAL_DUAL_RATER",
  "annotation_version": "1.0.0",
  "annotator_id": "EXPERT-RATER-01",
  "secondary_annotator_id": "EXPERT-RATER-02",
  "annotation_timestamp": "2026-09-06T13:07:00.614945+00:00",
  "video_fps": 30.0,
  "video_duration": 12.6,
  "frame_count": 378,
  "pool_context": {
    "pool_length_m": 25.0,
    "water_type": "Chlorinated",
    "camera_position": "Poolside_Surface",
    "calibration_type": "Body_Normalized"
  },
  "demographics": {
    "sex": "Male",
    "age_group": "Senior",
    "competition_level": "National"
  },
  "cycle_annotations": [
    {
      "cycle_index": 1,
      "start_frame": 40,
      "end_frame": 88,
      "duration_ms": 1600.0,
      "stroke_rate_spm": 37.5,
      "phase_events": [
        {
          "phase_name": "entry",
          "transition_frame": 40
        },
        {
          "phase_name": "pull",
          "transition_frame": 58
        },
        {
          "phase_name": "recovery",
          "transition_frame": 76
        }
      ]
    },
    {
      "cycle_index": 2,
      "start_frame": 88,
      "end_frame": 137,
      "duration_ms": 1633.3,
      "stroke_rate_spm": 36.73,
      "phase_events": [
        {
          "phase_name": "entry",
          "transition_frame": 88
        },
        {
          "phase_name": "pull",
          "transition_frame": 107
        },
        {
          "phase_name": "recovery",
          "transition_frame": 125
        }
      ]
    },
    {
      "cycle_index": 3,
      "start_frame": 137,
      "end_frame": 186,
      "duration_ms": 1633.3,
      "stroke_rate_spm": 36.73,
      "phase_events": [
        {
          "phase_name": "entry",
          "transition_frame": 137
        },
        {
          "phase_name": "pull",
          "transition_frame": 156
        },
        {
          "phase_name": "recovery",
          "transition_frame": 174
        }
      ]
    }
  ],
  "metric_annotations": {
    "stroke_rate_spm": {
      "value": 36.8,
      "source_modality": "HUMAN_VIDEO_ANNOTATION",
      "temporal_reference": "MID_POOL_STEADY_STATE"
    },
    "cycle_duration_ms": {
      "value": 1628.6,
      "source_modality": "HUMAN_VIDEO_ANNOTATION"
    },
    "true_dps_meters": {
      "value": null,
      "source_modality": "CALIBRATED_OPTICAL"
    },
    "hand_excursion_proxy_bl": {
      "value": 0.81,
      "source_modality": "HUMAN_VIDEO_ANNOTATION"
    },
    "mean_elbow_angle_deg": {
      "value": 145.0,
      "source_modality": "HUMAN_VIDEO_ANNOTATION",
      "angle_dimension": "2D_PLANAR"
    },
    "mean_knee_angle_deg": {
      "value": 155.9,
      "source_modality": "HUMAN_VIDEO_ANNOTATION",
      "angle_dimension": "2D_PLANAR"
    },
    "body_roll_amplitude_deg": {
      "value": 42.6,
      "source_modality": "HUMAN_VIDEO_ANNOTATION",
      "angle_dimension": "2D_PLANAR"
    },
    "stroke_symmetry_percent": {
      "value": 90.9,
      "source_modality": "HUMAN_VIDEO_ANNOTATION",
      "operational_definition": "Bilateral arm cycle phase duration symmetry (left/right ratio * 100)"
    }
  },
  "quality_flags": {
    "occlusion_level": "LOW",
    "lighting_quality": "HIGH",
    "water_turbulence": "CALM",
    "inter_rater_agreement_icc": 1.0,
    "requires_adjudication": false
  },
  "exclusion_status": "INCLUDED",
  "exclusion_reason": null,
  "is_synthetic_fixture": false
}