{
  "sample_id": "GT-FREE-002",
  "participant_id": "PARTICIPANT-002",
  "session_id": "SESSION-002",
  "stroke_type": "Freestyle",
  "video_id": "VIDEO-GT-FREE-002",
  "video_filename": "GT-FREE-002.mp4",
  "video_sha256": "5a6f8f56fc78194cd0103637690749f80b2e0bd36ee2bed6802fdd250749ac7c",
  "source_type": "HIGH_SPEED_OPTICAL_DUAL_RATER",
  "annotation_version": "1.0.0",
  "annotator_id": "EXPERT-RATER-01",
  "secondary_annotator_id": "EXPERT-RATER-02",
  "annotation_timestamp": "2026-09-06T15:33:18.496972+00:00",
  "video_fps": 30.0,
  "video_duration": 21.43,
  "frame_count": 643,
  "pool_context": {
    "pool_length_m": 25.0,
    "water_type": "Chlorinated",
    "camera_position": "Poolside_Surface",
    "calibration_type": "Body_Normalized"
  },
  "demographics": {
    "sex": "Female",
    "age_group": "Senior",
    "competition_level": "National"
  },
  "cycle_annotations": [
    {
      "cycle_index": 1,
      "start_frame": 60,
      "end_frame": 98,
      "duration_ms": 1266.7,
      "stroke_rate_spm": 47.37,
      "phase_events": [
        {
          "phase_name": "catch",
          "transition_frame": 70
        },
        {
          "phase_name": "pull",
          "transition_frame": 82
        },
        {
          "phase_name": "recovery",
          "transition_frame": 91
        }
      ]
    },
    {
      "cycle_index": 2,
      "start_frame": 98,
      "end_frame": 137,
      "duration_ms": 1300.0,
      "stroke_rate_spm": 46.15,
      "phase_events": [
        {
          "phase_name": "catch",
          "transition_frame": 108
        },
        {
          "phase_name": "pull",
          "transition_frame": 121
        },
        {
          "phase_name": "recovery",
          "transition_frame": 130
        }
      ]
    },
    {
      "cycle_index": 3,
      "start_frame": 137,
      "end_frame": 176,
      "duration_ms": 1300.0,
      "stroke_rate_spm": 46.15,
      "phase_events": [
        {
          "phase_name": "catch",
          "transition_frame": 147
        },
        {
          "phase_name": "pull",
          "transition_frame": 160
        },
        {
          "phase_name": "recovery",
          "transition_frame": 170
        }
      ]
    }
  ],
  "metric_annotations": {
    "stroke_rate_spm": {
      "value": 46.4,
      "source_modality": "HUMAN_VIDEO_ANNOTATION",
      "temporal_reference": "MID_POOL_STEADY_STATE"
    },
    "cycle_duration_ms": {
      "value": 1294.45,
      "source_modality": "HUMAN_VIDEO_ANNOTATION"
    },
    "true_dps_meters": {
      "value": null,
      "source_modality": "CALIBRATED_OPTICAL"
    },
    "hand_excursion_proxy_bl": {
      "value": 0.91,
      "source_modality": "HUMAN_VIDEO_ANNOTATION"
    },
    "mean_elbow_angle_deg": {
      "value": 140.1,
      "source_modality": "HUMAN_VIDEO_ANNOTATION",
      "angle_dimension": "2D_PLANAR"
    },
    "mean_knee_angle_deg": {
      "value": 165.1,
      "source_modality": "HUMAN_VIDEO_ANNOTATION",
      "angle_dimension": "2D_PLANAR"
    },
    "body_roll_amplitude_deg": {
      "value": 40.75,
      "source_modality": "HUMAN_VIDEO_ANNOTATION",
      "angle_dimension": "2D_PLANAR"
    },
    "stroke_symmetry_percent": {
      "value": 96.25,
      "source_modality": "HUMAN_VIDEO_ANNOTATION",
      "operational_definition": "Bilateral arm cycle phase duration symmetry (left/right ratio * 100)"
    }
  },
  "quality_flags": {
    "occlusion_level": "LOW",
    "lighting_quality": "HIGH",
    "water_turbulence": "CALM",
    "inter_rater_agreement_icc": null,
    "requires_adjudication": false
  },
  "exclusion_status": "INCLUDED",
  "exclusion_reason": null,
  "is_synthetic_fixture": false
}