{
  "sample_id": "GT-BRST-001",
  "participant_id": "PARTICIPANT-005",
  "session_id": "SESSION-005",
  "stroke_type": "Breaststroke",
  "video_id": "VIDEO-GT-BRST-001",
  "video_filename": "GT-BRST-001.mp4",
  "video_sha256": "62e30e6b534017bd2f78983428894b109c86e61788c1f03807e544a1180c1873",
  "source_type": "HIGH_SPEED_OPTICAL_DUAL_RATER",
  "annotation_version": "1.0.0",
  "annotator_id": "EXPERT-RATER-01",
  "secondary_annotator_id": "EXPERT-RATER-02",
  "annotation_timestamp": "2026-09-06T15:00:00Z",
  "video_fps": 30.0,
  "video_duration": 13.9,
  "frame_count": 417,
  "pool_context": {
    "pool_length_m": 25.0,
    "water_type": "Chlorinated",
    "camera_position": "Poolside_Surface",
    "calibration_type": "Body_Normalized"
  },
  "demographics": {
    "sex": "Female",
    "age_group": "Junior",
    "competition_level": "Club"
  },
  "cycle_annotations": [
    {
      "cycle_index": 1,
      "start_frame": 50,
      "end_frame": 96,
      "duration_ms": 1533.3,
      "stroke_rate_spm": 39.13,
      "phase_events": [
        {
          "phase_name": "outsweep",
          "transition_frame": 50
        },
        {
          "phase_name": "insweep",
          "transition_frame": 66
        },
        {
          "phase_name": "recovery",
          "transition_frame": 82
        }
      ]
    },
    {
      "cycle_index": 2,
      "start_frame": 96,
      "end_frame": 143,
      "duration_ms": 1566.7,
      "stroke_rate_spm": 38.3,
      "phase_events": [
        {
          "phase_name": "outsweep",
          "transition_frame": 96
        },
        {
          "phase_name": "insweep",
          "transition_frame": 113
        },
        {
          "phase_name": "recovery",
          "transition_frame": 129
        }
      ]
    },
    {
      "cycle_index": 3,
      "start_frame": 143,
      "end_frame": 190,
      "duration_ms": 1566.7,
      "stroke_rate_spm": 38.3,
      "phase_events": [
        {
          "phase_name": "outsweep",
          "transition_frame": 143
        },
        {
          "phase_name": "insweep",
          "transition_frame": 160
        },
        {
          "phase_name": "recovery",
          "transition_frame": 176
        }
      ]
    }
  ],
  "metric_annotations": {
    "stroke_rate_spm": {
      "value": 38.6,
      "source_modality": "HUMAN_VIDEO_ANNOTATION",
      "temporal_reference": "MID_POOL_STEADY_STATE"
    },
    "cycle_duration_ms": {
      "value": 1555.6,
      "source_modality": "HUMAN_VIDEO_ANNOTATION"
    },
    "true_dps_meters": {
      "value": null,
      "source_modality": "CALIBRATED_OPTICAL"
    },
    "hand_excursion_proxy_bl": {
      "value": 0.74,
      "source_modality": "HUMAN_VIDEO_ANNOTATION"
    },
    "mean_elbow_angle_deg": {
      "value": 122.0,
      "source_modality": "HUMAN_VIDEO_ANNOTATION",
      "angle_dimension": "2D_PLANAR"
    },
    "mean_knee_angle_deg": {
      "value": 118.0,
      "source_modality": "HUMAN_VIDEO_ANNOTATION",
      "angle_dimension": "2D_PLANAR"
    },
    "body_roll_amplitude_deg": {
      "value": 16.0,
      "source_modality": "HUMAN_VIDEO_ANNOTATION",
      "angle_dimension": "2D_PLANAR"
    },
    "stroke_symmetry_percent": {
      "value": 97.0,
      "source_modality": "HUMAN_VIDEO_ANNOTATION",
      "operational_definition": "Bilateral arm cycle phase duration symmetry (left/right ratio * 100)"
    }
  },
  "quality_flags": {
    "occlusion_level": "LOW",
    "lighting_quality": "HIGH",
    "water_turbulence": "CALM",
    "inter_rater_agreement_icc": null,
    "requires_adjudication": false
  },
  "exclusion_status": "INCLUDED",
  "exclusion_reason": null,
  "is_synthetic_fixture": false
}